{
  "$schema": "./consolidation_ledger.schema.json",
  "contract_version": "1.0.0",
  "freeze": {
    "active": false,
    "lifted_by": "Dr. Marcis Gasuns",
    "lifted_date": "2026-10-05",
    "lift_ruling": "MG in-chat ruling 05-10-2026 («да»): C5/C6 ratified via the VISA ROUTE — the standing per-article MG visa (review-sheet -> MG votes) is each of the 14 unknown slots' gate; no numeric per-slot kill-gates are invented (H1260 fence kept); C5/C6 section-7 pilot gates unchanged (SG-SE-006 stays kill_gated). The 18-07-2026 exit criterion (unknown=0) is superseded by this ruling.",
    "ruled_by": "Dr. Marcis Gasuns",
    "ruled_date": "2026-07-18",
    "ruling_handoff": "MG in-chat ruling, 18-07-2026",
    "installing_handoff": "H1260",
    "precedence_rule": "Sangram's 'full cadence' (the general 7C ruling that every research track stays at full production cadence) is superseded, for Sangram only, by this consolidation freeze: 'full cadence' now means consolidation cadence (repair/revise/visa/disposition of the 26 baseline candidates), not new-topic production. Other research tracks are unaffected.",
    "exit_criterion": "freeze.active flips to false only when every baseline_ids[] row has disposition in {published, revised, rejected, kill_gated} — i.e. disposition == 'unknown' for zero rows.",
    "baseline_snapshot_date": "2026-07-18",
    "related_handoffs": [
      "H1257 (applies 11 of the 26 baseline candidates' w2-core visa decisions; consumed here without duplication once it lands)",
      "H1229 (DCS-derived-number adversarial re-derivation; source of rederivation_evidence)"
    ],
    "counts": {
      "published_at_freeze": 9,
      "candidate_at_freeze": 26,
      "total_at_freeze": 35
    }
  },
  "last_refresh": {
    "date": "2026-10-22",
    "commands": [
      "python scripts/consolidation_ledger_refresh.py",
      "python scripts/article_validate.py --all",
      "python -m pytest",
      "npm run build"
    ],
    "build_status": "pass"
  },
  "published_context": [
    {
      "toc_ref": "SG-MO-002",
      "art_id": "art:a-stems",
      "path": "sangram/articles/a-stems/article.manifest.json"
    },
    {
      "toc_ref": "SG-MO-028",
      "art_id": "art:causative",
      "path": "sangram/articles/causative/article.manifest.json"
    },
    {
      "toc_ref": "SG-MO-001",
      "art_id": "art:declension-overview",
      "path": "sangram/articles/declension-overview/article.manifest.json"
    },
    {
      "toc_ref": "SG-MO-021",
      "art_id": "art:future",
      "path": "content/sangram/articles/future/article.manifest.json"
    },
    {
      "toc_ref": "SG-WF-003",
      "art_id": "art:krt-suffixes",
      "path": "sangram/articles/krt-suffixes/article.manifest.json"
    },
    {
      "toc_ref": "SG-MO-017",
      "art_id": "art:perfect",
      "path": "sangram/articles/perfect/article.manifest.json"
    },
    {
      "toc_ref": "SG-WF-004",
      "art_id": "art:taddhita-overview",
      "path": "sangram/articles/taddhita-overview/article.manifest.json"
    },
    {
      "toc_ref": "SG-WF-008",
      "art_id": "art:tatpurusha",
      "path": "sangram/articles/tatpurusha/article.manifest.json"
    },
    {
      "toc_ref": "SG-MO-013",
      "art_id": "art:thematic-present",
      "path": "sangram/articles/thematic-present/article.manifest.json"
    }
  ],
  "baseline_ids": [
    {
      "toc_ref": "SG-SE-004",
      "art_id": "art:ablative-genitive",
      "path": "sangram/articles/ablative-genitive/article.manifest.json",
      "revision_state": "candidate",
      "rederivation_evidence": {
        "status": "confirmed",
        "confirmed": 7,
        "refuted": 0,
        "checked_ids": [
          "SE004-1",
          "SE004-2",
          "SE004-3",
          "SE004-4",
          "SE004-5",
          "SE004-6",
          "SE004-7"
        ],
        "note": "H1229 adversarial re-derivation: 7/7 checks CONFIRMED, 0 REFUTED."
      },
      "visa_evidence": {
        "status": "not_submitted",
        "sheet": null,
        "note": ""
      },
      "validator_evidence": {
        "article_validate": "pass",
        "checked_at": "2026-10-22"
      },
      "disposition": "unknown",
      "blocking_note": "H1612 freeze probe: C6 programme kill-gate MISSING for SG-SE-004 (sem-a-genitive (+ Abl); not a § 7 pilot). C6 § 7 has no pilot for Abl/Gen. Gen-absolute candidate≠construction is a limit, not a kill-gate threshold. Integrity re-derive against pin 04e0778: PASS. Not inventing a threshold; leave disposition=unknown. Path to freeze exit: programme adds a named gate, or human visa→published outside the probe-first kill path.; UNBLOCKED 05-10-2026: MG in-chat «да» — C5/C6 visa route, freeze lifted; per-article MG visa is this slot's gate",
      "source_links": [
        "https://github.com/gasyoun/SanskritGrammar/blob/main/sangram/audit/probe_freeze_ablative-genitive.md",
        "https://github.com/gasyoun/Uprava/blob/main/handoffs/H1612-Opus_SanskritGrammar_freeze-probe-se-cluster_24.07.26.md"
      ]
    },
    {
      "toc_ref": "SG-MO-026",
      "art_id": "art:absolutive",
      "path": "sangram/articles/absolutive/article.manifest.json",
      "revision_state": "published",
      "rederivation_evidence": {
        "status": "confirmed",
        "confirmed": 2,
        "refuted": 0,
        "checked_ids": [
          "MO026-1",
          "MO026-2"
        ],
        "note": "H1229 adversarial re-derivation: 2/2 checks CONFIRMED, 0 REFUTED."
      },
      "visa_evidence": {
        "status": "approved",
        "sheet": "sangram-w2-core-11candidates-visa_17.07.26",
        "note": "vote='approve' on local review sheet 'sangram-w2-core-11candidates-visa_17.07.26' (short code 'MO26'); apply via its owning handoff, never by analogy."
      },
      "validator_evidence": {
        "article_validate": "pass",
        "checked_at": "2026-10-22"
      },
      "disposition": "published",
      "blocking_note": "",
      "source_links": [
        "https://github.com/gasyoun/SanskritGrammar/pull/472"
      ]
    },
    {
      "toc_ref": "SG-MO-019",
      "art_id": "art:aorist-types",
      "path": "sangram/articles/aorist-types/article.manifest.json",
      "revision_state": "candidate",
      "rederivation_evidence": {
        "status": "confirmed",
        "confirmed": 4,
        "refuted": 0,
        "checked_ids": [
          "MO017-1",
          "MO017-2",
          "MO017-3",
          "MO019-1"
        ],
        "note": "H1229 adversarial re-derivation: 4/4 checks CONFIRMED, 0 REFUTED."
      },
      "visa_evidence": {
        "status": "not_submitted",
        "sheet": null,
        "note": ""
      },
      "validator_evidence": {
        "article_validate": "pass",
        "checked_at": "2026-10-22"
      },
      "disposition": "unknown",
      "blocking_note": "H1613 park-and-skip 24-07-2026: C5 kill-gate criterion MISSING for this slot (see sangram/audit/FREEZE_EXIT_KILLGATE_MATRIX_2026.md · SG-MO-019). No invented threshold. Escalate: Human @DECIDE for a per-slot MO-019 gate, or visa-only path. Context: C5 EM2. Probe: sangram/audit/probe_freeze_aorist-types.{md,json,py}.; UNBLOCKED 05-10-2026: MG in-chat «да» — C5/C6 visa route, freeze lifted; per-article MG visa is this slot's gate",
      "source_links": [
        "https://github.com/gasyoun/SanskritGrammar/blob/main/sangram/audit/probe_freeze_aorist-types.md",
        "https://github.com/gasyoun/SanskritGrammar/blob/main/sangram/audit/FREEZE_EXIT_KILLGATE_MATRIX_2026.md",
        "https://github.com/gasyoun/Uprava/blob/main/handoffs/H1613-Opus_SanskritGrammar_freeze-probe-mo-wf-stragglers_24.07.26.md"
      ]
    },
    {
      "toc_ref": "SG-MO-018",
      "art_id": "art:aorist",
      "path": "sangram/articles/aorist/article.manifest.json",
      "revision_state": "published",
      "rederivation_evidence": {
        "status": "confirmed",
        "confirmed": 3,
        "refuted": 0,
        "checked_ids": [
          "MO017-1",
          "MO017-2",
          "MO018-1"
        ],
        "note": "H1229 adversarial re-derivation: 3/3 checks CONFIRMED, 0 REFUTED."
      },
      "visa_evidence": {
        "status": "approved",
        "sheet": "sangram-w2-core-11candidates-visa_17.07.26",
        "note": "vote='approve' on local review sheet 'sangram-w2-core-11candidates-visa_17.07.26' (short code 'MO18'); apply via its owning handoff, never by analogy."
      },
      "validator_evidence": {
        "article_validate": "pass",
        "checked_at": "2026-10-22"
      },
      "disposition": "published",
      "blocking_note": "",
      "source_links": [
        "https://github.com/gasyoun/SanskritGrammar/pull/472"
      ]
    },
    {
      "toc_ref": "SG-WF-009",
      "art_id": "art:bahuvrihi",
      "path": "sangram/articles/bahuvrihi/article.manifest.json",
      "revision_state": "candidate",
      "rederivation_evidence": {
        "status": "not_audited",
        "confirmed": 0,
        "refuted": 0,
        "checked_ids": [],
        "note": "no article-native published number fell inside H1229's 129-check adversarial re-derivation scope; absence of evidence, not evidence of correctness."
      },
      "visa_evidence": {
        "status": "not_submitted",
        "sheet": null,
        "note": ""
      },
      "validator_evidence": {
        "article_validate": "pass",
        "checked_at": "2026-10-22"
      },
      "disposition": "unknown",
      "blocking_note": "H1613 park-and-skip 24-07-2026: C5 kill-gate criterion MISSING for this slot (see sangram/audit/FREEZE_EXIT_KILLGATE_MATRIX_2026.md · SG-WF-009). No invented threshold. Escalate: @DECIDE: keep as limit-candidate → visa sheet, or rule kill_gated only if a human adopts a written freeze criterion. Probe: sangram/audit/probe_freeze_bahuvrihi.{md,json,py}.; UNBLOCKED 05-10-2026: MG in-chat «да» — C5/C6 visa route, freeze lifted; per-article MG visa is this slot's gate",
      "source_links": [